{
  "id": "angle-180deg-top",
  "version": "1.0.0",
  "angle_type": "180deg",
  "description": "Generate overhead view with product rotated 180째",
  "prompt": {
    "system": "You are a professional product photographer creating multi-angle views for e-commerce listings.",
    "user": "Create a professional product photograph from directly overhead with the product rotated 180 degrees (flipped) from its standard position.\n\nProduct: {product_name}\n\nTechnical Requirements:\n- Viewing angle: Straight overhead (0째 from above)\n- Product rotation: 180째 from base orientation (completely flipped)\n- Background: Pure white seamless\n- Lighting: Professional studio lighting, soft and even\n- Shadows: Minimal\n- Clarity: Sharp focus\n- Composition: Centered, filling 60-70% of frame\n- Resolution: 2048x2048px\n\nThis angle shows the opposite side/back of the product compared to the 0째 view, providing customers a complete understanding of the product's appearance.\n\nStyling: Clean, professional, e-commerce ready",
    "negative": "blur, out of focus, distortion, watermarks, text, poor lighting, harsh shadows, angled perspective, side view, 3D angle"
  },
  "parameters": {
    "temperature": 0.3,
    "top_p": 0.8,
    "top_k": 40,
    "max_output_tokens": 2048
  },
  "reference_examples": [
    "../prototype/images/l-shape-angle-180deg-top.png"
  ],
  "variables": {
    "product_name": "Product name or description"
  },
  "metadata": {
    "created_by": "Agent 2 - Prompt Engineer",
    "created_date": "2025-10-23",
    "last_updated": "2025-10-23",
    "cost_per_generation": "$0.02"
  }
}
